{
  "blocked_human_gates": [
    {
      "blocked_object": "pilot_and_formal_release",
      "evidence_path": "data/releases/task03_cross_cultural_experiment_v1/gates/GATE-ETHICS.json",
      "gate_id": "GATE-ETHICS",
      "module_id": "experiment",
      "reasons": [
        "No ethics approval or approved data-management, withdrawal, retention and deletion procedure."
      ],
      "scope": "TASK-03",
      "status": "blocked"
    },
    {
      "blocked_object": "pilot_and_formal_release",
      "evidence_path": "data/releases/task03_cross_cultural_experiment_v1/gates/GATE-EXPERIMENT-RUNTIME.json",
      "gate_id": "GATE-EXPERIMENT-RUNTIME",
      "module_id": "experiment",
      "reasons": [
        "A maintained experiment library or equivalent independent browser timing validation is required before a real pilot."
      ],
      "scope": "TASK-03",
      "status": "blocked"
    },
    {
      "blocked_object": "pilot_and_formal_release",
      "evidence_path": "data/fixtures/han_style_system/reference_handoff_v1/gates/GATE-EXPERT.json",
      "gate_id": "GATE-EXPERT",
      "module_id": "han_style",
      "reasons": [
        "No real expert review was requested or collected."
      ],
      "scope": "TASK-04",
      "status": "blocked"
    },
    {
      "blocked_object": "pilot_and_formal_release",
      "evidence_path": "data/fixtures/visual_measurements/reference_handoff_v2/GATE-EXPERT.json",
      "gate_id": "GATE-EXPERT",
      "module_id": "vision",
      "reasons": [
        "Two independent visual or type-domain reviewers have not reviewed fixture face validity and cross-script failure modes."
      ],
      "scope": "TASK-02",
      "status": "blocked"
    },
    {
      "blocked_object": "pilot_and_formal_release",
      "evidence_path": "data/releases/task03_cross_cultural_experiment_v1/gates/GATE-FORMAL-STIMULI.json",
      "gate_id": "GATE-FORMAL-STIMULI",
      "module_id": "experiment",
      "reasons": [
        "TASK-01 formal stimulus entrypoint is blocked; only an open engineering fixture is allowed."
      ],
      "scope": "TASK-03",
      "status": "blocked"
    },
    {
      "blocked_object": "pilot_and_formal_release",
      "evidence_path": "data/fixtures/asset_system/reference_handoff_v1/gates/GATE-HISTORY.json",
      "gate_id": "GATE-HISTORY",
      "module_id": "assets",
      "reasons": [
        "large tracked assets require a user-selected history strategy"
      ],
      "scope": "TASK-01",
      "status": "blocked"
    },
    {
      "blocked_object": "pilot_and_formal_release",
      "evidence_path": "data/releases/task03_cross_cultural_experiment_v1/gates/GATE-PARTICIPANTS.json",
      "gate_id": "GATE-PARTICIPANTS",
      "module_id": "experiment",
      "reasons": [
        "Recruitment, compensation, quotas, stopping rules and model-based sample size are not approved."
      ],
      "scope": "TASK-03",
      "status": "blocked"
    },
    {
      "blocked_object": "pilot_and_formal_release",
      "evidence_path": "data/fixtures/asset_system/reference_handoff_v1/gates/GATE-RELEASE.json",
      "gate_id": "GATE-RELEASE",
      "module_id": "assets",
      "reasons": [
        "formal rights and human curation gates are not passed"
      ],
      "scope": "TASK-01",
      "status": "blocked"
    },
    {
      "blocked_object": "formal_release",
      "evidence_path": "docs/joint_analysis_protocol_zh.md",
      "gate_id": "GATE-RELEASE",
      "module_id": "workbench",
      "reasons": [
        "Synthetic inputs and unresolved human gates mechanically block formal release."
      ],
      "scope": "system",
      "status": "blocked"
    },
    {
      "blocked_object": "pilot_and_formal_release",
      "evidence_path": "data/fixtures/asset_system/reference_handoff_v1/gates/GATE-RIGHTS.json",
      "gate_id": "GATE-RIGHTS",
      "module_id": "assets",
      "reasons": [
        "licence pages and redistribution permissions are unverified"
      ],
      "scope": "TASK-01",
      "status": "blocked"
    },
    {
      "blocked_object": "pilot_and_formal_release",
      "evidence_path": "data/fixtures/han_style_system/reference_handoff_v1/gates/GATE-RIGHTS.json",
      "gate_id": "GATE-RIGHTS",
      "module_id": "han_style",
      "reasons": [
        "No historical or modern typeface asset has TASK-04 formal-use approval."
      ],
      "scope": "TASK-04",
      "status": "blocked"
    },
    {
      "blocked_object": "pilot_and_formal_release",
      "evidence_path": "data/fixtures/asset_system/reference_handoff_v1/gates/GATE-TERMS.json",
      "gate_id": "GATE-TERMS",
      "module_id": "assets",
      "reasons": [
        "official terms, authentication, cost, and data flow have not been reviewed"
      ],
      "scope": "TASK-01",
      "status": "blocked"
    },
    {
      "blocked_object": "pilot_and_formal_release",
      "evidence_path": "data/fixtures/han_style_system/reference_handoff_v1/gates/GATE-TERMS.json",
      "gate_id": "GATE-TERMS",
      "module_id": "han_style",
      "reasons": [
        "No restricted download, login, licence acceptance, or paid access was reviewed."
      ],
      "scope": "TASK-04",
      "status": "blocked"
    },
    {
      "blocked_object": "real_social_input",
      "evidence_path": "docs/workbench_local_ops_zh.md",
      "gate_id": "GATE-TERMS",
      "module_id": "social",
      "reasons": [
        "No real request, terms acceptance, credential use or paid access was approved."
      ],
      "scope": "real_platform_collection",
      "status": "blocked"
    },
    {
      "blocked_object": "pilot_and_formal_release",
      "evidence_path": "data/releases/task03_cross_cultural_experiment_v1/gates/GATE-TRANSLATION.json",
      "gate_id": "GATE-TRANSLATION",
      "module_id": "experiment",
      "reasons": [
        "English, Japanese and Korean drafts lack human committee review, back-translation and cognitive interviews."
      ],
      "scope": "TASK-03",
      "status": "blocked"
    }
  ],
  "contract_versions": {
    "analysis_plan": "1.0.0",
    "analysis_run": "1.0.0",
    "catalog": "1.0.0",
    "coordinated_backup": "1.0.0",
    "gate_decision": "1.0.0",
    "module_descriptor": "1.0.0",
    "release_candidate": "1.0.0",
    "social_validated_export": "v17",
    "workbench_handoff": "1.0.0"
  },
  "created_at": "2026-09-04T11:55:46Z",
  "data_boundaries": [
    {
      "allowed": true,
      "classification": "synthetic",
      "reason": "Allowed only for local engineering, demo audit and reproducibility checks.",
      "reason_code": "SYNTHETIC_DEMO_ONLY"
    },
    {
      "allowed": false,
      "classification": "synthetic",
      "reason": "Synthetic ratings and evidence cannot support formal research release.",
      "reason_code": "FORMAL_RELEASE_FORBIDDEN"
    },
    {
      "allowed": false,
      "classification": "participant_pii",
      "reason": "Identity maps and participant PII are outside the workbench contract.",
      "reason_code": "PII_NOT_IMPORTED"
    },
    {
      "allowed": false,
      "classification": "social_raw_payload",
      "reason": "Only validated export pointers and hashes enter the catalog.",
      "reason_code": "RAW_PLATFORM_PAYLOAD_NOT_IMPORTED"
    },
    {
      "allowed": false,
      "classification": "restricted_asset",
      "reason": "Catalog stores only source-owned pointers and classifications.",
      "reason_code": "RESTRICTED_ASSET_NOT_COPIED"
    },
    {
      "allowed": false,
      "classification": "wp2_context",
      "reason": "WP2 remains hypothesis/context unless a preregistered exposure operation exists.",
      "reason_code": "NARRATIVE_NOT_PARTICIPANT_EXPOSURE"
    }
  ],
  "handoff_schema_version": "1.0.0",
  "implementation_commit": "3947de40ebeb24799999bbd0ff866ce07c50355f",
  "input_handoffs": [
    {
      "compatible": true,
      "module_id": "assets",
      "path": "data/fixtures/asset_system/reference_handoff_v1/handoff_manifest.json",
      "producer_commit": "f89daec0e5e1f2df216a8e18c551d81f9954032f",
      "readiness": {
        "engineering_ready": true,
        "pilot_ready": false,
        "research_validated": false
      },
      "schema_version": "2.0.0",
      "sha256": "acc193134495401b9a026aab0e7a866d7f15202b9b865db0d73d6f689bd1bdab",
      "task_id": "TASK-01"
    },
    {
      "compatible": true,
      "module_id": "vision",
      "path": "data/fixtures/visual_measurements/reference_handoff_v2/handoff_manifest.json",
      "producer_commit": "e3fc34883a0a2ec6ff30fbd56dd950d7c7fd2306",
      "readiness": {
        "engineering_ready": true,
        "pilot_ready": false,
        "research_validated": false
      },
      "schema_version": "1.1.0",
      "sha256": "d039330f7aceb12d3a3620c99bdb2749dfaf51421b97df606ee0c87a10446ba8",
      "task_id": "TASK-02"
    },
    {
      "compatible": true,
      "module_id": "experiment",
      "path": "data/releases/task03_cross_cultural_experiment_v1/handoff_manifest.json",
      "producer_commit": "2048fa9866eb8cedc58b7399958331eae5f4325e",
      "readiness": {
        "engineering_ready": true,
        "pilot_ready": false,
        "research_validated": false
      },
      "schema_version": "2.0.0",
      "sha256": "cbc05b928e7dad5a0e4e12c0b0788ed6af98267169ec3232a16764081b68636c",
      "task_id": "TASK-03"
    },
    {
      "compatible": true,
      "module_id": "han_style",
      "path": "data/fixtures/han_style_system/reference_handoff_v1/handoff_manifest.json",
      "producer_commit": "cecdf3325f8701b5e4125d35811ed58b6580564d",
      "readiness": {
        "engineering_ready": true,
        "pilot_ready": false,
        "research_validated": false
      },
      "schema_version": "1.1.0",
      "sha256": "803c8c5b97fce3fc521ee4944a16e6a4834bd6a769a397845d9c9b96fc233fbe",
      "task_id": "TASK-04"
    }
  ],
  "interfaces": {
    "commands": [
      "uv run glyph-workbench serve --catalog-database CATALOG --social-database SOCIAL",